{
  "$comment": "GENERATED BY tools/schemagen — DO NOT HAND EDIT",
  "$id": "urn:nself:cli:schema:shared-proxy:v1",
  "$schema": "https://json-schema.org/draft/2020-12/schema",
  "additionalProperties": false,
  "properties": {
    "_generated": {
      "const": "GENERATED BY nself build - DO NOT HAND EDIT",
      "type": "string"
    },
    "files": {
      "items": {
        "pattern": "^(nginx/sites|ssl/certificates)/[^/]+(/[^/]+)*$",
        "type": "string"
      },
      "type": "array"
    },
    "network": {
      "type": "string"
    },
    "project": {
      "type": "string"
    },
    "project_dir": {
      "type": "string"
    },
    "schema_version": {
      "const": "1",
      "type": "string"
    },
    "server_names": {
      "items": {
        "type": "string"
      },
      "type": "array"
    },
    "service_names": {
      "items": {
        "type": "string"
      },
      "type": "array"
    },
    "verbatim_upstream_hosts": {
      "items": {
        "type": "string"
      },
      "type": "array"
    }
  },
  "required": [
    "_generated",
    "files",
    "network",
    "project",
    "project_dir",
    "schema_version",
    "server_names",
    "service_names",
    "verbatim_upstream_hosts"
  ],
  "type": "object"
}
