{
  "_generated": "GENERATED BY nself build - DO NOT HAND EDIT",
  "files": [
    "nginx/sites/bproj.api-docs.conf",
    "nginx/sites/bproj.auth.conf",
    "nginx/sites/bproj.hasura.conf",
    "nginx/sites/bproj.mail.conf"
  ],
  "network": "bproj_network",
  "project": "bproj",
  "project_dir": "<ROOT>/stack/backend",
  "schema_version": "1",
  "server_names": [
    "api.b.test",
    "auth.b.test",
    "docs.b.test",
    "mail.b.test"
  ],
  "service_names": [
    "auth",
    "hasura",
    "mailpit",
    "postgres"
  ],
  "verbatim_upstream_hosts": []
}
