{
  "_generated": "GENERATED BY nself build - DO NOT HAND EDIT",
  "files": [],
  "network": "owna_network",
  "project": "owna",
  "project_dir": "<ROOT>/stack",
  "schema_version": "1",
  "server_names": [
    "api.a.test",
    "auth.a.test",
    "notify.a.test"
  ],
  "service_names": [
    "auth",
    "hasura",
    "nginx",
    "notify",
    "postgres",
    "redis"
  ],
  "verbatim_upstream_hosts": []
}
